{
  "schema_version": "1.0",
  "kind": "native_text",
  "title": "勤務実績修正届 処理要領（架空）",
  "page_count": 1,
  "expected_full_text": "勤務実績修正届 処理要領（架空）\n文書番号: 架空人給第17号　施行日: 2026年4月1日\n1. 目的\n本要領は、勤務実績の登録誤りを給与計算前に修正する手順を定める。\n2. 提出期限\n所属の給与事務担当者は、修正対象月の翌月5日までに提出する。\n3. 必要書類\n・勤務実績修正届\n・所属長確認書\n4. 処理\n人事給与課は受付後3営業日以内に内容を確認し、結果を所属へ通知する。\n注: 本文書はRAG評価専用の架空資料であり、実在の制度ではない。",
  "critical_values": [
    "2026年4月1日",
    "翌月5日",
    "3営業日以内"
  ],
  "confidence": {
    "source": "native_text_layer",
    "value": 1.0,
    "review_required": false
  },
  "pages": [
    {
      "page": 1,
      "width_points": 595.2756,
      "height_points": 841.8898,
      "source_image_sha256": "9c2f4e4d400f06de86913d105ae07db600ec99ea2cda1a7e00574364e1dd7763",
      "expected_text": "勤務実績修正届 処理要領（架空）\n文書番号: 架空人給第17号　施行日: 2026年4月1日\n1. 目的\n本要領は、勤務実績の登録誤りを給与計算前に修正する手順を定める。\n2. 提出期限\n所属の給与事務担当者は、修正対象月の翌月5日までに提出する。\n3. 必要書類\n・勤務実績修正届\n・所属長確認書\n4. 処理\n人事給与課は受付後3営業日以内に内容を確認し、結果を所属へ通知する。\n注: 本文書はRAG評価専用の架空資料であり、実在の制度ではない。",
      "blocks": [
        {
          "id": "title",
          "text": "勤務実績修正届 処理要領（架空）",
          "bbox": {
            "x0": 0.0874,
            "y0": 0.0616,
            "x1": 0.556,
            "y1": 0.089
          }
        },
        {
          "id": "document_meta",
          "text": "文書番号: 架空人給第17号　施行日: 2026年4月1日",
          "bbox": {
            "x0": 0.0874,
            "y0": 0.1103,
            "x1": 0.4352,
            "y1": 0.127
          }
        },
        {
          "id": "purpose_heading",
          "text": "1. 目的",
          "bbox": {
            "x0": 0.0874,
            "y0": 0.1721,
            "x1": 0.162,
            "y1": 0.1935
          }
        },
        {
          "id": "purpose",
          "text": "本要領は、勤務実績の登録誤りを給与計算前に修正する手順を定める。",
          "bbox": {
            "x0": 0.0874,
            "y0": 0.2083,
            "x1": 0.6585,
            "y1": 0.2267
          }
        },
        {
          "id": "deadline_heading",
          "text": "2. 提出期限",
          "bbox": {
            "x0": 0.0874,
            "y0": 0.2671,
            "x1": 0.2057,
            "y1": 0.2885
          }
        },
        {
          "id": "deadline",
          "text": "所属の給与事務担当者は、修正対象月の翌月5日までに提出する。",
          "bbox": {
            "x0": 0.0874,
            "y0": 0.3034,
            "x1": 0.6154,
            "y1": 0.3218
          }
        },
        {
          "id": "attachments_heading",
          "text": "3. 必要書類",
          "bbox": {
            "x0": 0.0874,
            "y0": 0.3621,
            "x1": 0.2057,
            "y1": 0.3835
          }
        },
        {
          "id": "attachment_1",
          "text": "・勤務実績修正届",
          "bbox": {
            "x0": 0.1142,
            "y0": 0.3984,
            "x1": 0.2621,
            "y1": 0.4168
          }
        },
        {
          "id": "attachment_2",
          "text": "・所属長確認書",
          "bbox": {
            "x0": 0.1142,
            "y0": 0.4293,
            "x1": 0.2444,
            "y1": 0.4477
          }
        },
        {
          "id": "processing_heading",
          "text": "4. 処理",
          "bbox": {
            "x0": 0.0874,
            "y0": 0.4881,
            "x1": 0.162,
            "y1": 0.5094
          }
        },
        {
          "id": "processing",
          "text": "人事給与課は受付後3営業日以内に内容を確認し、結果を所属へ通知する。",
          "bbox": {
            "x0": 0.0874,
            "y0": 0.5243,
            "x1": 0.686,
            "y1": 0.5427
          }
        },
        {
          "id": "note",
          "text": "注: 本文書はRAG評価専用の架空資料であり、実在の制度ではない。",
          "bbox": {
            "x0": 0.0874,
            "y0": 0.88,
            "x1": 0.5586,
            "y1": 0.8967
          }
        }
      ]
    }
  ]
}
